[
  {
    "id": "about",
    "file": "src/app/about/page.tsx",
    "route": "/about",
    "component_type": "server",
    "data_source": "none",
    "middleware_protected": false,
    "layout_guard": null,
    "page_guard": null,
    "effective_protection": "public",
    "render_mode": "static",
    "dead_or_duplicate": false,
    "findings": []
  },
  {
    "id": "admin-login",
    "file": "src/app/admin-login/page.tsx",
    "route": "/admin-login",
    "component_type": "client",
    "data_source": "supabase-browser",
    "middleware_protected": false,
    "layout_guard": null,
    "page_guard": "getUser",
    "effective_protection": "auth",
    "render_mode": "static",
    "dead_or_duplicate": false,
    "findings": []
  },
  {
    "id": "admin.experiments.id",
    "file": "src/app/admin/experiments/[id]/page.tsx",
    "route": "/admin/experiments/[id]",
    "component_type": "client",
    "data_source": "api:/api/admin/experiments/${id}+/api/admin/experiments/${id}/results",
    "middleware_protected": false,
    "layout_guard": "src/app/admin/layout.tsx",
    "page_guard": null,
    "effective_protection": "admin",
    "render_mode": "dynamic",
    "dead_or_duplicate": false,
    "findings": []
  },
  {
    "id": "admin.experiments",
    "file": "src/app/admin/experiments/page.tsx",
    "route": "/admin/experiments",
    "component_type": "client",
    "data_source": "api:/api/admin/experiments",
    "middleware_protected": false,
    "layout_guard": "src/app/admin/layout.tsx",
    "page_guard": null,
    "effective_protection": "admin",
    "render_mode": "dynamic",
    "dead_or_duplicate": false,
    "findings": []
  },
  {
    "id": "banned",
    "file": "src/app/banned/page.tsx",
    "route": "/banned",
    "component_type": "server",
    "data_source": "supabase-cookie-server",
    "middleware_protected": false,
    "layout_guard": null,
    "page_guard": "getUser",
    "effective_protection": "auth",
    "render_mode": "dynamic",
    "dead_or_duplicate": false,
    "findings": []
  },
  {
    "id": "calendar",
    "file": "src/app/calendar/page.tsx",
    "route": "/calendar",
    "component_type": "client",
    "data_source": "api:/api/events/${event.id}/rsvp+/api/events/${event.id}/save; auth-store",
    "middleware_protected": false,
    "layout_guard": null,
    "page_guard": "useAuthStore",
    "effective_protection": "auth",
    "render_mode": "static",
    "dead_or_duplicate": false,
    "findings": []
  },
  {
    "id": "clubs.id",
    "file": "src/app/clubs/[id]/page.tsx",
    "route": "/clubs/[id]",
    "component_type": "server",
    "data_source": "supabase-cookie-server",
    "middleware_protected": false,
    "layout_guard": null,
    "page_guard": "getUser",
    "effective_protection": "auth",
    "render_mode": "dynamic",
    "dead_or_duplicate": false,
    "findings": []
  },
  {
    "id": "clubs.create",
    "file": "src/app/clubs/create/page.tsx",
    "route": "/clubs/create",
    "component_type": "server",
    "data_source": "none",
    "middleware_protected": false,
    "layout_guard": null,
    "page_guard": null,
    "effective_protection": "public",
    "render_mode": "static",
    "dead_or_duplicate": false,
    "findings": []
  },
  {
    "id": "clubs",
    "file": "src/app/clubs/page.tsx",
    "route": "/clubs",
    "component_type": "server",
    "data_source": "supabase-cookie-server",
    "middleware_protected": false,
    "layout_guard": null,
    "page_guard": null,
    "effective_protection": "public",
    "render_mode": "dynamic",
    "dead_or_duplicate": false,
    "findings": []
  },
  {
    "id": "contributors",
    "file": "src/app/contributors/page.tsx",
    "route": "/contributors",
    "component_type": "server",
    "data_source": "none",
    "middleware_protected": false,
    "layout_guard": null,
    "page_guard": null,
    "effective_protection": "public",
    "render_mode": "static",
    "dead_or_duplicate": false,
    "findings": []
  },
  {
    "id": "create-event",
    "file": "src/app/create-event/page.tsx",
    "route": "/create-event",
    "component_type": "client",
    "data_source": "auth-store",
    "middleware_protected": true,
    "layout_guard": null,
    "page_guard": "useAuthStore",
    "effective_protection": "auth",
    "render_mode": "static",
    "dead_or_duplicate": false,
    "findings": []
  },
  {
    "id": "docs",
    "file": "src/app/docs/page.tsx",
    "route": "/docs",
    "component_type": "server",
    "data_source": "none",
    "middleware_protected": false,
    "layout_guard": null,
    "page_guard": null,
    "effective_protection": "public",
    "render_mode": "static",
    "dead_or_duplicate": false,
    "findings": []
  },
  {
    "id": "events.id",
    "file": "src/app/events/[id]/page.tsx",
    "route": "/events/[id]",
    "component_type": "server",
    "data_source": "supabase-cookie-server",
    "middleware_protected": false,
    "layout_guard": null,
    "page_guard": null,
    "effective_protection": "public",
    "render_mode": "dynamic",
    "dead_or_duplicate": false,
    "findings": []
  },
  {
    "id": "feedback",
    "file": "src/app/feedback/page.tsx",
    "route": "/feedback",
    "component_type": "client",
    "data_source": "api:/api/feedback",
    "middleware_protected": false,
    "layout_guard": null,
    "page_guard": null,
    "effective_protection": "public",
    "render_mode": "static",
    "dead_or_duplicate": false,
    "findings": []
  },
  {
    "id": "friends",
    "file": "src/app/friends/page.tsx",
    "route": "/friends",
    "component_type": "client",
    "data_source": "api:/api/users/${person.id}/follow+/api/users/${userId}/follow+/api/users/me/friends+/api/users/me/requests+/api/users/me/suggestions+/api/users/search; auth-store",
    "middleware_protected": true,
    "layout_guard": null,
    "page_guard": "useAuthStore",
    "effective_protection": "auth",
    "render_mode": "static",
    "dead_or_duplicate": false,
    "findings": []
  },
  {
    "id": "health",
    "file": "src/app/health/page.tsx",
    "route": "/health",
    "component_type": "client",
    "data_source": "api:/api/health",
    "middleware_protected": false,
    "layout_guard": null,
    "page_guard": null,
    "effective_protection": "public",
    "render_mode": "static",
    "dead_or_duplicate": false,
    "findings": []
  },
  {
    "id": "help",
    "file": "src/app/help/page.tsx",
    "route": "/help",
    "component_type": "client",
    "data_source": "none",
    "middleware_protected": false,
    "layout_guard": null,
    "page_guard": null,
    "effective_protection": "public",
    "render_mode": "static",
    "dead_or_duplicate": false,
    "findings": []
  },
  {
    "id": "invites.token",
    "file": "src/app/invites/[token]/page.tsx",
    "route": "/invites/[token]",
    "component_type": "server",
    "data_source": "supabase-cookie-server",
    "middleware_protected": true,
    "layout_guard": null,
    "page_guard": "getUser",
    "effective_protection": "auth",
    "render_mode": "dynamic",
    "dead_or_duplicate": false,
    "findings": []
  },
  {
    "id": "landing",
    "file": "src/app/landing/page.tsx",
    "route": "/landing",
    "component_type": "client",
    "data_source": "none",
    "middleware_protected": false,
    "layout_guard": null,
    "page_guard": null,
    "effective_protection": "public",
    "render_mode": "static",
    "dead_or_duplicate": false,
    "findings": []
  },
  {
    "id": "moderation.appeals",
    "file": "src/app/moderation/appeals/page.tsx",
    "route": "/moderation/appeals",
    "component_type": "client",
    "data_source": "api:/api/admin/clubs+/api/admin/events",
    "middleware_protected": false,
    "layout_guard": "src/app/moderation/layout.tsx",
    "page_guard": null,
    "effective_protection": "admin",
    "render_mode": "dynamic",
    "dead_or_duplicate": false,
    "findings": []
  },
  {
    "id": "moderation.audit-log",
    "file": "src/app/moderation/audit-log/page.tsx",
    "route": "/moderation/audit-log",
    "component_type": "client",
    "data_source": "api:/api/admin/audit-log",
    "middleware_protected": false,
    "layout_guard": "src/app/moderation/layout.tsx",
    "page_guard": null,
    "effective_protection": "admin",
    "render_mode": "dynamic",
    "dead_or_duplicate": false,
    "findings": []
  },
  {
    "id": "moderation.clubs",
    "file": "src/app/moderation/clubs/page.tsx",
    "route": "/moderation/clubs",
    "component_type": "client",
    "data_source": "api:/api/admin/clubs+/api/admin/clubs/${clubId}+/api/admin/clubs/${rejectingClub.id}+/api/admin/clubs/${suspendingClub.id}",
    "middleware_protected": false,
    "layout_guard": "src/app/moderation/layout.tsx",
    "page_guard": null,
    "effective_protection": "admin",
    "render_mode": "dynamic",
    "dead_or_duplicate": false,
    "findings": []
  },
  {
    "id": "moderation.events",
    "file": "src/app/moderation/events/page.tsx",
    "route": "/moderation/events",
    "component_type": "client",
    "data_source": "api:/api/admin/events+/api/admin/events/${id}+/api/admin/events/${id}/status+/api/admin/events/${rejectingEvent.id}/status+/api/admin/events/${suspendingEvent.id}/status",
    "middleware_protected": false,
    "layout_guard": "src/app/moderation/layout.tsx",
    "page_guard": null,
    "effective_protection": "admin",
    "render_mode": "dynamic",
    "dead_or_duplicate": false,
    "findings": []
  },
  {
    "id": "moderation.featured",
    "file": "src/app/moderation/featured/page.tsx",
    "route": "/moderation/featured",
    "component_type": "client",
    "data_source": "api:/api/admin/events+/api/admin/featured+/api/admin/featured/${id}",
    "middleware_protected": false,
    "layout_guard": "src/app/moderation/layout.tsx",
    "page_guard": null,
    "effective_protection": "admin",
    "render_mode": "dynamic",
    "dead_or_duplicate": false,
    "findings": []
  },
  {
    "id": "moderation.organizer-requests",